{
  "schema": "panda.fanout.plan.v1",
  "plan_id": "fo_gwas-followup-001",
  "created_at": "2026-10-25T12:00:00.000Z",
  "objective": "Verify the three published GWAS loci against the independent QC report without crossing write scopes.",
  "max_parallel": 3,
  "tasks": [
    {
      "task_id": "t_locus-audit",
      "role": "evidence-auditor",
      "objective": "Check each locus claim against the QC table and the source line.",
      "inputs": ["corpus/studies/dcj-gwas.md"],
      "outputs": ["memory/audit/gwas-loci.md"],
      "write_scope": ["memory/audit/"],
      "depends_on": [],
      "acceptance": ["Every locus cites source_path:source_line", "No claim without evidence_id"],
      "status": "pending"
    },
    {
      "task_id": "t_number-check",
      "role": "number-verifier",
      "objective": "Recompute the reported effect sizes and compare them to the published numbers.",
      "inputs": ["corpus/studies/dcj-gwas.md", "pipeline/reports/"],
      "outputs": ["memory/audit/gwas-numbers.md"],
      "write_scope": ["memory/audit/"],
      "depends_on": ["t_locus-audit"],
      "acceptance": ["Every number cites evidence_id", "Mismatches are listed explicitly"],
      "status": "pending"
    }
  ],
  "merge": {
    "strategy": "union",
    "verifier": "control-evidence-ledger",
    "conflict_policy": "fail"
  },
  "budget": {
    "max_runs": 3,
    "max_tokens": 120000,
    "max_cost_usd": 2.5
  },
  "status": "draft"
}
